{
	"$schema": "./schemas/stack.schema.json",
	"project": {
		"name": "nomos-ai",
		"runtime": "bun",
		"packageManager": "bun@1.3.0",
		"monorepo": true,
		"buildSystem": "turborepo"
	},
	"packages": [
		{
			"name": "web",
			"path": "apps/web",
			"layer": "frontend",
			"language": "typescript",
			"framework": "react",
			"dependencies": [
				{
					"name": "react",
					"version": "19.2.3",
					"purpose": "UI framework — React 19 with Server Components support",
					"category": "ui-library",
					"provides": [
						"JSX",
						"hooks",
						"concurrent rendering",
						"use hook",
						"Server Components"
					],
					"docs": "react",
					"bestPractices": [
						"Use React 19 'use' hook for promises/context instead of useEffect+useState",
						"Prefer function components with hooks over class components",
						"Use React.lazy + Suspense for code splitting"
					]
				},
				{
					"name": "react-dom",
					"version": "19.2.3",
					"purpose": "React DOM rendering",
					"category": "ui-library"
				},
				{
					"name": "@tanstack/react-router",
					"version": "^1.141.1",
					"purpose": "File-based routing with type-safe navigation",
					"category": "router",
					"provides": [
						"file-based routes",
						"type-safe links",
						"search params",
						"loaders",
						"route context"
					],
					"docs": "@tanstack/react-router",
					"bestPractices": [
						"Define routes in apps/web/src/routes/ using file-based convention",
						"Use routeTree.gen.ts (auto-generated — never edit manually)",
						"Use Link component for navigation, never raw <a> tags for internal routes",
						"Use route loaders for data fetching, not useEffect"
					]
				},
				{
					"name": "@tanstack/react-query",
					"version": "^5.90.12",
					"purpose": "Server state management, caching, and data fetching",
					"category": "data-fetching",
					"provides": [
						"useQuery",
						"useMutation",
						"query invalidation",
						"optimistic updates",
						"infinite queries"
					],
					"docs": "@tanstack/react-query",
					"bestPractices": [
						"Use with @orpc/tanstack-query for type-safe API calls",
						"Never use raw fetch/axios — always go through TanStack Query",
						"Invalidate queries after mutations using queryClient.invalidateQueries",
						"Use staleTime to control refetch behavior"
					]
				},
				{
					"name": "@orpc/tanstack-query",
					"version": "^1.12.2",
					"purpose": "Type-safe bridge between oRPC and TanStack Query",
					"category": "data-fetching",
					"provides": ["type-safe query hooks from oRPC contracts"],
					"bestPractices": [
						"Import hooks from the configured oRPC client, not raw TanStack Query",
						"oRPC provides end-to-end type safety — never manually type API responses"
					]
				},
				{
					"name": "@orpc/client",
					"version": "^1.12.2",
					"purpose": "oRPC client for type-safe API communication",
					"category": "api-client",
					"provides": ["type-safe RPC client", "contract-first API calls"],
					"docs": "@orpc/client"
				},
				{
					"name": "zustand",
					"version": "^5.0.10",
					"purpose": "Client-side state management (non-server state)",
					"category": "state-management",
					"provides": [
						"global stores",
						"selectors",
						"middleware",
						"persist",
						"devtools"
					],
					"docs": "zustand",
					"bestPractices": [
						"Use Zustand for CLIENT state only (UI state, preferences, local selections)",
						"Use TanStack Query for SERVER state (API data, cached entities)",
						"Never duplicate server data in Zustand stores",
						"Keep stores small and focused — one store per domain"
					]
				},
				{
					"name": "tailwindcss",
					"version": "^4.0.15",
					"purpose": "Utility-first CSS framework",
					"category": "css-framework",
					"dev": true,
					"provides": [
						"utility classes",
						"responsive design",
						"dark mode",
						"CSS variables"
					],
					"docs": "tailwindcss",
					"bestPractices": [
						"Tailwind v4 uses CSS-based config (index.css @theme), NOT tailwind.config.js",
						"Use the cn() utility from lib/utils.ts for conditional classes",
						"Use tw-animate-css for animations, not custom keyframes",
						"Use Tailwind classes directly — never write custom CSS unless unavoidable"
					]
				},
				{
					"name": "@tailwindcss/vite",
					"version": "^4.0.15",
					"purpose": "Tailwind CSS Vite plugin for v4",
					"category": "build-tool"
				},
				{
					"name": "shadcn",
					"version": "^3.6.2",
					"purpose": "CLI for installing shadcn/ui components (copy-paste component system)",
					"category": "ui-primitives",
					"provides": ["component installer CLI"],
					"bestPractices": [
						"Install components via 'bunx shadcn@latest add <component>' from apps/web/",
						"Components are copied to apps/web/src/components/ui/ — they are editable",
						"NEVER hand-roll a component that shadcn provides — install it instead",
						"Check the installed list before building custom UI"
					]
				},
				{
					"name": "@base-ui/react",
					"version": "^1.0.0",
					"purpose": "Unstyled UI primitives (used by shadcn base-lyra style)",
					"category": "ui-primitives",
					"provides": [
						"headless UI primitives",
						"accessibility",
						"keyboard navigation"
					],
					"bestPractices": [
						"Base UI replaces Radix UI in the base-lyra shadcn style",
						"Do not install @radix-ui packages — use @base-ui/react instead",
						"Primitives are unstyled — always apply Tailwind classes"
					]
				},
				{
					"name": "class-variance-authority",
					"version": "^0.7.1",
					"purpose": "Variant-based component styling (cva)",
					"category": "utilities",
					"provides": ["cva function for component variants"],
					"bestPractices": [
						"Use cva() for components with multiple visual variants",
						"Combine with cn() for conditional class merging"
					]
				},
				{
					"name": "clsx",
					"version": "^2.1.1",
					"purpose": "Conditional className construction",
					"category": "utilities",
					"provides": ["clsx function"]
				},
				{
					"name": "tailwind-merge",
					"version": "^3.3.1",
					"purpose": "Merge Tailwind classes without conflicts",
					"category": "utilities",
					"provides": ["twMerge function"],
					"bestPractices": [
						"Always use cn() (wraps clsx + twMerge) from lib/utils.ts instead of raw clsx or twMerge"
					]
				},
				{
					"name": "lucide-react",
					"version": "^0.473.0",
					"purpose": "Icon library",
					"category": "icons",
					"provides": ["SVG icon components"],
					"bestPractices": [
						"Import icons individually: import { Home } from 'lucide-react'",
						"NEVER use other icon libraries — lucide-react is the standard"
					]
				},
				{
					"name": "sonner",
					"version": "^2.0.5",
					"purpose": "Toast notifications",
					"category": "ui-library",
					"provides": ["toast function", "Toaster component"],
					"bestPractices": [
						"Use toast() from sonner for all user notifications",
						"Toaster component is already mounted via shadcn sonner component"
					]
				},
				{
					"name": "next-themes",
					"version": "^0.4.6",
					"purpose": "Theme management (light/dark mode)",
					"category": "utilities",
					"provides": ["ThemeProvider", "useTheme hook"],
					"bestPractices": [
						"Use useTheme() hook for theme switching",
						"ThemeProvider wraps the app — check root layout"
					]
				},
				{
					"name": "tw-animate-css",
					"version": "^1.2.5",
					"purpose": "Tailwind CSS animation utilities",
					"category": "animations",
					"provides": ["animate-* Tailwind classes"]
				},
				{
					"name": "@tanstack/react-form",
					"version": "^1.12.3",
					"purpose": "Type-safe form management",
					"category": "ui-library",
					"provides": ["useForm", "form validation", "field-level validation"],
					"docs": "@tanstack/react-form",
					"bestPractices": [
						"Use TanStack Form for all forms, not raw useState or uncontrolled inputs",
						"Combine with Zod validators via @hookform/resolvers"
					]
				},
				{
					"name": "@hookform/resolvers",
					"version": "^5.1.1",
					"purpose": "Schema validation resolvers for forms",
					"category": "validation",
					"provides": ["zodResolver for form validation"]
				},
				{
					"name": "better-auth",
					"version": "^1.4.9",
					"purpose": "Authentication library (client-side)",
					"category": "auth",
					"provides": ["auth client", "session management", "social login"],
					"docs": "better-auth"
				},
				{
					"name": "zod",
					"version": "^4.1.13",
					"purpose": "Schema validation and type inference",
					"category": "validation",
					"provides": ["schema definition", "parsing", "type inference"],
					"docs": "zod",
					"bestPractices": [
						"This is Zod v4 — use z.object(), z.string(), etc.",
						"Use Zod schemas as single source of truth for validation",
						"Infer TypeScript types from Zod schemas: z.infer<typeof schema>"
					]
				},
				{
					"name": "vite",
					"version": "^6.2.2",
					"purpose": "Build tool and dev server",
					"category": "build-tool",
					"dev": true,
					"provides": ["dev server", "HMR", "build", "preview"]
				},
				{
					"name": "@vitejs/plugin-react",
					"version": "^4.3.4",
					"purpose": "React support for Vite (JSX transform, Fast Refresh)",
					"category": "build-tool",
					"dev": true
				},
				{
					"name": "@tanstack/router-plugin",
					"version": "^1.141.1",
					"purpose": "Vite plugin for TanStack Router file-based routing",
					"category": "build-tool",
					"dev": true
				},
				{
					"name": "@tanstack/react-query-devtools",
					"version": "^5.91.1",
					"purpose": "TanStack Query developer tools",
					"category": "testing",
					"dev": true
				},
				{
					"name": "@tanstack/react-router-devtools",
					"version": "^1.141.1",
					"purpose": "TanStack Router developer tools",